{
  "$schema": "../schemas/marketplace-index.schema.json",
  "registryVersion": 1,
  "name": "Codecaine Community",
  "description": "Remixes, apps, design systems and skills for the canvas editor.",
  "root": "../",
  "site": "https://community.codecainehq.com",
  "repository": "https://github.com/vv-zero-oss/codecaine-marketplace",
  "updated": "2026-10-29",
  "catalogs": {
    "remix": {
      "url": "json/remixes.json",
      "count": 38
    },
    "app": {
      "url": "json/apps.json",
      "count": 1
    },
    "design-system": {
      "url": "json/design-systems.json",
      "count": 8
    },
    "skill": {
      "url": "json/skills.json",
      "count": 2
    }
  }
}
